id,type,text1,text2,text3,text4,notes
,,,,,,
#SHIP WEAPONS,,,,,,
rebelrats_equalizer_l,WEAPON,"The Equalizer's ponderous shots can shatter even the thickest armor plates. Its origins are as old as the Krysan Federal Monarchy, with it seeing first use in the defence of Magawa from loyalist elements.",,,,
rebelrats_doldrums_l,WEAPON,"The Doldrums-Pattern railgun is the most capable weapon in the Khrysan Navy arsenal, firing devastating AM-tipped warheads. The Federal Navy built the Doldrums during Khrysan Orbital Defence Program but later retooled the railgun to install them on Krysan Cruisers and Battleships as per the new Mobile Defence Doctrine.",Does this show up?,,,
rebelrats_drummer_l,WEAPON,The Drummer is an offshoot development of the Doldrums-Pattern railgun family. It utilizes an electrothermal-chemical firing system and gauss coils to fire inert rods against enemy shields,,,,
rebelrats_goedendag_l,WEAPON,"Buried behind the stealth composite plating is a complex series of carefully engineered electromagnets, capacitors, and extensive cooling equipment snaking around a set of magazines connected to the ship’s internal ammo forges. The Goedendag railgun is built to give the Jerboa the firepower to square off with its peers if its onboard missiles aren’t sufficient.",,,,
rebelrats_mangonel_l,WEAPON,"At its core, the Mangonel is a reverse engineered TPC from a wrecked Onslaught. By overcharging the weapon, The Three Brothers Corporation magnified the damage of its shots beyond what the original TPC was designed for. Despite its ability to inflict horrific effects on enemy ships, the Mangonel has seen limited service in the Krysan Fleet due to its costly flux requirements.",,,,
rebelrats_nezulana_l,WEAPON,"A railgun designed by the rebel rats in order to break capital-grade shields. Following the success of the Drummer, the Nezulana utilizes a scaled-up version of the same electrothermal-chemical launch system to hurl saboted hyperdense penetrating rods at enemy shields.",,,,
rebelrats_salvo_autoloader,WEAPON,"Initially a testbed bed for the Porcellus Battlecruiser's missile tubes, the design is now installed in most of the Federal Navy's capital ships as a finisher weapon with its unparalleled reliability.",,,,
,,,,,,
rebelrats_siegeharq_m,WEAPON,"Determined to create an anti-armor weapon, Rebel Rat engineers fashioned a barrel extension and an AM-energized warhead to modernize the antiquated artillery pieces found on Magawa after the Penance War.",,,,
rebelrats_crossbow_m,WEAPON,The Crossbow is designed based on existing static defense emplacements. They are loaded with specialized anti-shield rounds fired from their electrothermal-chemical breech and can quickly bring down enemy shields during battle.,,,,
rebelrats_falcon_m,WEAPON,Falcon missiles carry a shrapnel warhead designed to shred through lightly armored ships and exposed hulls. They possess more maneuverability than speed to counter the frigates of the sector,,,,
rebelrats_hwacha_m,WEAPON,"Created from the Land Mattress Weapons Program, the Hwacha MLRS is simple in concept, it fires mass amounts of Hwacha missiles to saturate an enemy's point defense grid, acting as decoys for larger more potent torpedos to hit the enemy.",,,,
rebelrats_custodian_m,WEAPON,The Custodian brings the much needed capability to bring down multiple targets with a single shot. Its built-in autoloader ensures that the gun is quickly fed flak shells during battle.,,,,
rebelrats_muridae_m,WEAPON,"Created by The Three Brothers Corporation and leased to Rebel Rat Industries, the launcher fires hyper-charged plasma bolts that melt through armour and hull. However, its downside is its relatively high flux requirements and its tendency to overheat that limits its capabilities.",,,,
rebelrats_arratoi_m,WEAPON,These are powerful railguns that fire standard issue anti-shield rounds. The Arratoi were developed for the Rattus Modernization Project to augment the firepower of the Rattus against increasingly hardy spacecraft shields.,,,,
rebelrats_petard_m,WEAPON,"Using laser activated nuclear pellets in a reinforced chamber, the Petard is a terrifying weapon to be struck by. Barrel Rectifiers would guide the released energy into a concentrated beam as it exits the gun and produce horrific results if the hull is directly struck, working similar to that of Krysan Pest Control equipment.",,,,
rebelrats_braggador_m,WEAPON,"Created to bridge the gap between long ranged flak and smaller short ranged PD, the Braggador’s quad guns can easily shoot down enemy torpedoes or blunt incoming enemy bomber runs.",,,,
rebelrats_rattenjager_m,WEAPON,The Rattenjager utilizes advanced algorithms and a smart-fuze system to intercept fighters and missiles. An integrated ammo feeder in the turret mount allows the weapon to be constantly fed with new missiles during battle. ,,,,
rebelrats_rattenjager_array_m,WEAPON,A built-in array of Snapper Hardkill APS for long-range interceptions,,,,
rebelrats_petardlauncher_m,WEAPON,"Seeing that the Petard conveniently came in ready-to-use canisters, it didn't take long for someone to mount thrusters and a guidance system to make a rudimentary, but effective, DEM",,,,
rebelrats_huntsman_salvo,WEAPON,Triple rack for Huntsman Torpedos,,,,
,,,,,,
#MUS HUNTSMAN AUTOLOADER,,,,,,
rebelrats_huntsmanx2_m,WEAPON,These torpedo tubes serve as the Mus' main anti-ship weapon and it allows the Mus to punch above its weight class. The tubes utilize an autoloader derived from the Rattus that is directly linked to the Mus' onboard microforge.,,,,
,,,,,,
rebelrats_huntsman_s,WEAPON,"Ubiquitous on Krysan Navy ships, the Huntsman is a guided torpedo designed similarly to the Persean Sector's Harpoons. The Huntsman's AM-catalysed warhead allow it to punch through contemporary armor plates.",,,,
rebelrats_hwacha_s,WEAPON,"The Hwacha SRM takes inspiration from the Swarmer SRM, dutifully fulfilling atmospheric and non-atmospheric anti-fighter craft roles with high agility. ",,,,
rebelrats_ranger,WEAPON,"Developed from the turret of a SPAAG, the Ranger quickly destroys incoming targets with a burst of accurate fire.",,,,
rebelrats_fowler,WEAPON,"Created from the large surplus amount of lower caliber cannons available after the Penance War, the Fowler is an amalgamation of 8 low caliber barrels grouped together to fire a wall of bullets, achieving accuracy by volume of fire.",,,,
rebelrats_culverin,WEAPON,"A simple weapon, the Culverin is the standard issue high-explosive light anti-ship weapon for the Krysan Navy. Its two internal magazines let it fire HE shells in rapid bursts.",,,,
rebelrats_longbow,WEAPON,"The Longbow is the standard issue light anti-shield weapon for the Khrysan Navy. It fires small inert rounds that are relatively effective against enemy shields, especially against frigates that have smaller flux cores.",,,,
rebelrats_huntsmanx2,WEAPON,Dual rack for the Huntsman Torpedo,,,,
rebelrats_hawker,WEAPON,The Hawker is a pirate's favorite. It utilizes time-fuzed canister shells to quickly bring down incoming groups of missiles,,,,
rebelrats_pyroclast,WEAPON,The Pyroclast is the Federal Navy's answer to the Reaper. It uses a hypercharged AM-shaped charge warhead with raw penetration values measured in kilometers to break through heavy ship armor. Its built-in thruster system ensures that it hits the target.,,,,
rebelrats_rattus_torp,WEAPON,"This is an autoloader that has been fitted into the ship's center weapons module. It can quickly reload Huntsman torpedoes, allowing the Rattus to conduct rapid strikes and replenish missiles through its onboard microforge.",,,,
rebelrats_ashford,WEAPON,"The Ashford is comparable to Persean Sector lasers with its signature variable lense that allows it to have a higher effective range than other Krysan PD weapons. It utilizes newly found materials mined in the sector to induce EMP arcs on targets, often disabling their engines and sending them on a death spiral.",,,,
rebelrats_poacher_s,WEAPON,"Favoring accuracy by volume like ancient CIWS designs, the Poacher was an anti-ship weapon that was handed PD duties. The turret's APIT shells coupled with an astounding rate of fire allows it to shred through destroyer-grade armor plating relatively quickly when enmassed.",,,,
rebelrats_poubelle,WEAPON,"Less of a missile and more of a mobile IED cobbled from off-the-shelf civilian components, the torpedo lacks the robust thruster system that Federal navy missiles have but it makes up for it with a larger payload that can easily sledge through thick armor",,,,
,,,,,,
#FIGHTER WEAPONS,,,,,,
rebelrats_huntsman_f,WEAPON,"A fighter-mounted version of the Huntsman Torpedo stowed under the fuselage due to its size. The fighter's weight restrictions downsized the torpedo's warhead, but will still be sufficient to threaten ships, especially those with thin armor.",,,,
rebelrats_ranger_f,WEAPON,"A stripped-down version of the Ranger, the cannon has a decreased fire rate for better heat management and less velocity per shell to limit vibrations in the fighter's chassis.",,,,
rebelrats_hwacha_f,WEAPON,"Modified for fighter use, Hwachas have proven to be effective for fighters due to its speed and agility, so the weapon sees mass use throughout Krysan strike craft.",,,,
rebelrats_guardsman_f,WEAPON,Guardsman-Pattern turrets have their roots in old Krysan naval ship armaments as CIWS installations. They are the mainstay armaments of Hippo Skiffs and bombers due to their ubiquity and ability to function with minimal maintenance.,,,,
rebelrats_vaybchek,WEAPON,"Overcharged plasma mining tools, the Vaybchek purposefully overloads its mining cartridges to produce a higher output. This unsafe practice commonly led to premature breech explosions when done wrong, often injuring the crew.",,,,
rebelrats_pyroclast_f,WEAPON,"Removing the complex thruster system and fitted with a solid rocket motor, this version of the Pyroclast is meant to be fitted into the Olympian's magnetic bomb launcher.",,,,
rebelrats_felis,WEAPON,Built-in PD laser created for the Patron corvette. Extremely effective against fighters and missiles despite its high flux costs.,,,,
rebelrats_ashford_f,WEAPON,A tuned down Ashford for fighter use.,,,,
rebelrats_chaingun_f,WEAPON,Fires armor piercing incendiary rounds specialized for shredding thinly armored spacecraft.,,,,
rebelrats_falcon_f,WEAPON,A wing mounting bracket for falcons.,,,,
,,,,,,
#FIGHTERS,,,,,,
rebelrats_sultan,SHIP,"The Sultan is the Krysan Navy's premier fighter. It was built and designed by Rebel Rats to operate both in atmosphere and space, acting as a multi-role SSTO fighter. Its large arsenal of weapons is enough to deal with most enemies in battle space, especially with its underslung Huntsman torpedo to help it hunt larger spacecraft.",,,,
rebelrats_proctor,SHIP,"More of an engine than a fighter, the Proctor was created to counter the growing number of pirates in the Persean Sector. Its armaments allow it to hunt frigates, but it quickly falters against concentrated enemy PD fire with its lack of shields despite extensive armoring around crucial internal systems.",,,,
rebelrats_hippo,SHIP,"The Hippo is the standard-issue skiff of Krysan Federal Navy warships. They allow Krysan Ships to insert a platoon of marines into a planetary battlespace or initiate boarding action agaisnt enemy ships and stations with breaching charges. Outside of dropship duties, the skiffs can act as impromptu PD boats to screen its mothership with its Guardsman turrets.",,,,
rebelrats_overseer,SHIP,"A light interceptor of the Krysan Federal Navy, the Overseer is a hardy fighter created by Arms & Armor. The craft comes equipped with a Hwacha missile rack and a pair of Ranger autocannons, making a wing of Overseers a threat to enemy shields.",,,,
rebelrats_ministro,SHIP,"The Ministro is a lightweight, unmanned interceptor drone designed by Rebel Rat Industries as a proposal to Krysan Navy officials to reduce pilot losses. It quickly found success with increasingly advanced drone control systems that allowed finer control with unmanned drones.",,,,
rebelrats_patron_f,SHIP,An array of microforges have been set up on this carrier to maintain a wing of Patron Corvettes. ,,,,
rebelrats_daekon,SHIP,A fast assault fighter built to break the shields of the enemy spacecraft and shred their armor with assault chainguns.,,,,
,,,,,,
#BOMBERS,,,,,,
rebelrats_olympian,SHIP,"Despite its shambolic origins of being made from the remains of Piranha bombers, the Olympian is a capable bomber that dutifully does its job with more than enough armor and PD coverage to last it through its bombing run. A recurring joke among Olympian pilots is that the onboard warhead contains a Red Bombardier Rat as its payload.",,,,
rebelrats_bluster,SHIP,The Bluster has its origins from juryrigged shuttlecraft in mining fleets around Asteroid Central Station who looked for a temporary solution to the growing pirate problem. A salvaged guardsman turret sits on top of the Bluster's engine block to serve as all around protection against enemy fightercraft.,,,,
,,,,,,
#COMBAT SHIPS ,,,,,,
rebelrats_porcellus,SHIP,"Bristling with weaponry and cladded in thick composites, the Porcellus is the most common capital ship found in Krysan Federal Navy battlegroups. In the ship's hangars, the Porcellus carries a pair of skiffs that can conduct rapid military insertions, or act as PD screens during engagements.

The Porcellus is designed by the Arms and Armor Conglomerate and is built in the massive orbital berths of Kaharian Naval Steelworks. Being based off of a venerable design in the days of the Empire, the prototype model initially lacked effective PD coverage and long-ranged weaponry, but improvements to PD designs and new technologies brought by the development of the Mobile Defence Doctrine made the Porcellus one of the safest ships in the Krysan Federal Navy.

At the ship’s core, four Barkley-Pattern Heavy-Duty AM-catalysed flux reactors are responsible for powering the ship’s Basilica-Model shield generator and its set of four massive H303 Torch Drives and two secondary H302 Torch Drives.
",,,,
rebelrats_marmot,SHIP,"Marmot Heavy Cruisers form the backbone of Krysan Battlegroups. The ship’s modular weapon mounts and hangars means that the ship can fill most roles that captains may require. The Marmot is the first ship to be officially equipped with the Doldrums-Pattern Superheavy Railgun for the Navy’s newly conceived Mobile Defence Doctrine, allowing the ship to bring station-grade weaponry to battles.

Designed by Veronica Witherfield, Rebel Rats Head Designer, the ship is often made squadron leader in Patrol Flotillas as command centres for captains conducting mercantile protection. During larger pitched battles, the Marmot serves as second-line warships to provide fire support and fighter craft coverage for capital ships. The heavy cruiser is notable for its performance during the Siege of Nutria when squadrons of Marmot cruisers and Rattus destroyers broke through Remnant forces and lifted the siege with minimal losses.

Equipped with two M405 Torch Drives, the Marmot can easily manoeuvre around the battlefield to take advantage of opportunities. The ship is powered by two Barkley-Pattern Heavy-Duty AM-catalysed flux reactors that power the ship’s torch drives and dual shield generators.
",,,,
rebelrats_jerboa,SHIP,"The Jerboa is the Federal Navy’s stealth cruiser. It employs redundant layers of stealth composites reduce sensor profile to conduct covert special operations. However, for the occasional ship-to-ship engagements, its Goedendag railgun provide the necessary firepower to duel enemy ships brave enough to spar with the ship.

Built by The Three Brothers Corporation, the Jerboa is the main warship of the Krysan Special Operations Command and is commonly used in commerce raiding and special recon missions. Apart from the Goedendag Railgun, the Jerboa is equipped with additional modular mounts and a small hangar bay that can be modified to suit the needs of the given mission.

The ship uses two heavily modified M503 Torch Drives fed by three Sleipnir-Pattern Hyper Cooled flux reactors. Apart from its use of stealth composites, the Jerboa also runs extensive hull cooling systems to hide it in the infrared spectrum, often storing waste heat in its 2 massive internal heat sinks or recycle it back to power auxiliary systems until the ship can dump it out safely out of prying eyes.
",,,,
rebelrats_matkaboska,SHIP,"Despite lacking the mounts for a Doldrums, the Matka Boska makes up for it with copious amounts of modular firepower and armor. The ship has a solid reputation for keeping its crew safe during heavy engagements thanks to its armor layout. Due to this apparent hardiness, the ship became a favorite for officers to use as command ships who want to keep close to the contact lines.

The Matka Boska was unfortunately conceived right before the culmination of the Mobile Defence Doctrine development. Due to this, the ship does not have the correct mountings nor a sufficient reactor to accommodate the Doldrums. Instead, the ship relies on thick slabs of frontal ablative armour and an arsenal of missiles to even out its fights.

The base design of the ship predates that of the Marmot and even resembles that of archaic Krysan warships due to Rebel Rat engineers taking direct inspiration from said ships, and so, taking design cues from older ships, the Matka Boska not only boasts heavier armour than its contemporaries, but also better structural integrity and hardier citadels to keep its crew safe during engagements.

The ship is equipped with two Barkley-Pattern AM-catalysed flux reactors to power its singular H305 Torch Drive and its Basilica-Model shield generator. Multiple redundant systems are in place to make sure that the ship can get the crew back to safety.
",,,,
rebelrats_steersman,SHIP,"The Steersman is an armored cruiser built in belter shipyards meant to escort belter trade convoys from increasing pirate threats. On its sides, the ship sports racks of Poubelle Torpedos for anti-ship usage while its large weapon mount is at the front and buried behind layers of armor.

A direct evolution from the Helmsman, this ship is a more serious take in creating a functional belter warship and a sign of things to come. The hull is visibly armoured with massive rivets dotting the ship's hull and an armoured retractable armored door hangs over the hangar. Despite this, the ship can still falter to pressure from professionally made warships if care during battle is not given.

Hailing from the docks of the Asteroid Central Station, the Steersman represents the Belter will to be independents and its wish to remove piracy within the system. The ship was made to coutneract the growing levels of piracy coming from the rest of the Persean Sector and protect vulnerable independent traders.

Its onboard fusion torch is a design derived from the most successful Helmsman homebrewed fusion torch drive named the Mammoth Fusion Torch. Three Bobcat-Pattern flux reactors power the ship's systems and the torch drive.",,,,
rebelrats_mellivora,SHIP,"Though thin skinned and lightly armed, the Mellivora’s high-capacity hangars provide the fighter cover for itself and other ships in the fleet. It heavily relies on its speed and fighters to keep enemy ships at a distance and to strike opponents.

Realizing the need for a mobile light carrier, Krysan High Command commissioned Arms & Armor to design a light carrier with high mobility. And so, with Arms & Armor having prior carrier building experience from creating the Porcellus, the development for the Mellivora was quick and had no difficulties.

With the ship's interiors being relatively newer in design with automation reducing crew count, its sleep spaces offer more privacy and headspace to its crew despite the spaces being bunks. Unfortunately, onboard amenities such as the kitchen galley had to be reduced to maximize the space inside the ship.

The ship is equipped with 4 M505 and is powered with the latest model flux reactors. Despite the Mellivora’s size, its onboard hangar facilities are comparatively more spacious for its designed capacity than on bigger Federal Navy ships such as the Marmot and Porcellus, increasing crew comfort during carrier operations.
",,,,
rebelrats_monax_p,SHIP,"Taking advantage of the Monax's commonality, pirates have replaced the internals of its cargo bays with snaking munition belts and armor plates. What used to be its cargo bay has been replaced by hangar bays and its shuttle bays turned into concealed missile tubes. The extensive upgunning and uparmouring of the hull has earned it the light cruiser classification within Federal Navy records.

While at a glance, two Monax(P)s are seemingly alike, the lack of standardization with the pirate modifications of Monax(P)s means that no two ships are completely the same. One ship may sport slightly thicker armor while another may be having larger flux batteries as requirements differ from one captain to another.

Despite extensive upgrades to the hull, an inexperienced captain can be easily caught off guard in battle if they get too greedy in their Monax(P). Any pirate captain, experienced enough, knows that the ship is never able to fight peer to peer enemy ships; with its lackluster flux reactor core and jury-rigged shield module, a Monax(P) can easily falter to enemy fire.
",,,,
rebelrats_rattus,SHIP,"The Rattus is an ancient design that predates the Krysan Federal Navy. The design was extensively updated by the Rebel Rats Head of Design, Violet Witherfield, giving it new Arratoi railguns to crack enemy shields, a new AM-catalysed flux reactor to power the ship’s new shield system, and an onboard micro-forge to reload its torpedo launcher.

Dubbed as “The Blue Angel”, the Rattus was instrumental during Penance Day when disillusioned captains led a massive rebellion against the Krysan Empire, leading to a brutal 8-year long civil war that would culminate in the dissolution of the Empire and the formation of the Federal Monarchy of Krysa. During the rebellion, Rattus destroyers were used in guerrilla tactics and rapid insertion of rebel forces into orbital stations to seize decommissioned empire ships.

Following the principles of thrust-gravity oriented design, the Rattus has a narrow hull with a vertical layout, leading to a smaller front cross section that allows Rattus captains to minimize the chances of the enemy landing a hit, though to the disdain of crewmembers needing to navigate up and down the ship’s tight vertical spaces with steep ladders.
",,,,
rebelrats_helmsman,SHIP,"Despite its makeshift appearance, the Helmsman’s barebones design gives it outstanding agility with its outrigged RCS thrusters. Its onboard shield generator was ripped off of a salvaged Monax cargo ship and tuned to the size of the Helmsman. Despite this, the ship is surprisingly adequately armed for its size, but can’t handle similarly sized ships that have proper flux cores.

With captains that can only be described as desperate daredevils with no regard for their own indemnity, the Helmsman is manually constructed in the hands of any person desperate enough with the wanderlust for star travel or piracy. Its interior spaces are cramped and reminiscent of ancient planetary submersibles with parts of the crew sleeping in cramped bunks with very little headroom or privacy. 

Its fusion torch engine is usually homebrewed from a Frankenstein of parts while its flux reactor is usually a Bobcat-Pattern Flux Reactor taken from a salvaged Monax.
",,,,
rebelrats_mus,SHIP,"Bearing unparalleled speed and brash firepower, the Mus is a menace on the battlefield when left unattended. The ship’s built-in plasma launchers and torpedo tubes allow it to spar with larger ships while its new S601 Fusion Torch gives it the speed to easily keep up with enemy frigates. However, this emphasis on movement meant that armor had to be sacrificed, leaivng the Mus with very thin armor.

Rebel Rat Industries created the Mus to serve alongside the Rattus as its escort. As the newest addition to the Krysan Federal Navy, the Mus enjoys better shield generators that are more efficient at taking shots and provides wider coverage than older shield models.

Despite being a recent addition, the Mus quickly became a common sight along Krysan trade routes as a pursuit ship against any roving pirate ship.
",,,,
rebelrats_patron,SHIP,"A corvette built to provide laser PD coverage for ships, the Patron can use its bow mounted Felis LAWS to quickly sweep through fighter formations. However, ironically, due to its diminutive size, the Patron is vulnerable to being overwhelmed by fighters if it operates alone due to the Felis LAWS’ limited firing arc.

Created by Arms & Armor, there was no expenses spared in the creation of the Patron. The interior has been carefully modelled to house the 4-man cockpit as comfortably as possible. The designers had even included a dedicated galley for the crew, which, as small as it is, goes a long way during long voyages for crew comfort. Unfortunately, this meant that the vessel has little in the way of protection, being comparable to that on armoured fighter craft.

The corvette is one of the few deep space ships that still maintains older-type fusion engines, that being two XS801 Pion Pulse Fusion Engines. The ship’s energy is maintained by a side mounted Minuitoid flux reactor, a fairly recent development in the miniaturization of Flux Reactor technology.
",,,,
,,,,,,
#LOGISTICS SHIPS,,,,,,
